title,view_num,danmu,upload_time,up_author,video_url
粤菜高手藏身菜场，想见他一面得排队半年？,24.0万,,2022/11/16,米雪食记,www.bilibili.com/video/BV1KK411Z797?from=search
【粤菜专题】令大部分广州人心甘情愿排队的粤菜到底是怎样的？,3.2万,,2023/3/13,大兵探店,www.bilibili.com/video/BV1V8411F7Dw?from=search
中国四大菜系 - 苏菜、川菜、鲁菜、粤菜 【地图可视化】,3.6万,,2020/5/11,_江之岛盾子_,www.bilibili.com/video/BV1St4y117xE?from=search
【粤菜专题】凭一道黄鳝煲就可以封神，广州30年老牌街坊粤菜,2.3万,,2023/3/23,大兵探店,www.bilibili.com/video/BV1rm4y1k7Gc?from=search
耗时7天7夜还原濒临失传的传奇粤菜金沙白玉，徒手扎破36000个柚子油苞太解压了,41.0万,,2023/5/15,菜男烧小菜,www.bilibili.com/video/BV1hk4y1L7RY?from=search
在年销售额177亿的商场吃顿粤菜，以为差点不够钱结账！,15.2万,,2021/5/19,无所尉吃什么,www.bilibili.com/video/BV1m64y1d7Gx?from=search
利苑—曾经的粤菜黄埔军校，现如今菜做的怎么样,21.2万,,2022/11/11,特厨魏味-,www.bilibili.com/video/BV1Cg411s7aC?from=search
香港一家四口的日常｜晚餐vlog｜家常粤菜｜腐竹鱼头煲｜苦瓜炒牛肉｜白切鸡｜上汤菠菜,21.1万,,2022/3/5,莫默mok,www.bilibili.com/video/BV1TT4y1D7iP?from=search
广州最贵乳鸽！一位难求的粤菜之光，到底有多好吃？,55.2万,,2022/6/9,渣叔爱酒,www.bilibili.com/video/BV1pt4y1W7Pf?from=search
东北人不能做粤菜吗,23.8万,,2023/6/24,依依私厨,www.bilibili.com/video/BV1Mg4y1N7mM?from=search
丹麦公婆狂炫饭上桌一盘光一盘!吃到嘴流油!父女抢食大战!场面失控!最好吃粤菜馆探店,16.6万,,2023/1/7,北欧冷冰冰,www.bilibili.com/video/BV1dK411y7BH?from=search
把鸡蛋直接丢进油锅炸，做一道粤菜“五柳炸蛋”酸甜可口超下饭！,8.3万,,2021/11/2,洋仔开箱a,www.bilibili.com/video/BV1oU4y1u7zR?from=search
总在排行前三的网红粤菜馆，胖小伙吃了好评不断，文案小哥却觉得平平无奇？【就得这么晚-05细记港九】,110.6万,,2021/12/1,王师傅和小毛毛,www.bilibili.com/video/BV1JS4y1X7YL?from=search
街坊帮衬四十年的低调老广饭堂，在广州十年，它是我心中出品最稳定的老牌粤菜之一。,30.6万,,2023/6/6,NAV看广州B站版,www.bilibili.com/video/BV1v14y1D75o?from=search
广州人均1500的粤菜Omakase天花板，居然让人吃石头？,11.1万,,2021/7/30,我就翻一下,www.bilibili.com/video/BV1Rf4y157PR?from=search
私宅品质粤菜！多汁大扣肉入口化｜成都美味探店,43.9万,,2021/5/3,密子君,www.bilibili.com/video/BV1t54y157Zg?from=search
沈阳有名的高端粤菜店，懂的来看看这个粤菜做的正宗吗？,6.4万,,2023/6/19,胖虎老刘,www.bilibili.com/video/BV1WP411q73u?from=search
石家庄粤菜系列（一） 广味饭店,4457,,2023/5/29,吃的有点挑,www.bilibili.com/video/BV1po4y137eQ?from=search
澳门??最难预订的米其林三⭐粤菜馆‼️,5.7万,,2022/11/10,常戴夫,www.bilibili.com/video/BV1Ud4y1r7B9?from=search
古法粤菜之㊙️禾花鲤鱼腊味炊饭,15.6万,,2023/1/28,常戴夫,www.bilibili.com/video/BV1HY4y1R7rh?from=search
孤独美食者之CC爱粤菜分享，你看饿了吗？敲好吃的水晶虾皇～炒米粉yyds,8.1万,,2023/4/24,CC宝玉玉,www.bilibili.com/video/BV1aa4y1V7Uw?from=search
粤菜高手藏身菜场，想见他一面得排队半年？,24.0万,,2022/11/16,米雪食记,www.bilibili.com/video/BV1KK411Z797?from=search
在北京找到了很大排档的粤菜馆！炒海瓜子、炸虾枣、蒜蓉生蚝…是新的快乐老家了！,8728,,2023/9/4,瑭瑭的日记本,www.bilibili.com/video/BV1Mw411D7MR?from=search
中国四大菜系 - 苏菜、川菜、鲁菜、粤菜 【地图可视化】,3.6万,,2020/5/11,_江之岛盾子_,www.bilibili.com/video/BV1St4y117xE?from=search
粤点粤菜粤精彩，南粤名山，白云山，粤语中字幕,1296,,2022/2/12,Amy爱你的每一天,www.bilibili.com/video/BV1rr4y1h7n8?from=search
耗时7天7夜还原濒临失传的传奇粤菜金沙白玉，徒手扎破36000个柚子油苞太解压了,41.0万,,2023/5/15,菜男烧小菜,www.bilibili.com/video/BV1hk4y1L7RY?from=search
同两位大师傅，徐嘉乐先生、梅安利先生到顺德粤菜研发基地吃午饭,1.1万,,2023/8/29,番薯叔叔的美食杂货,www.bilibili.com/video/BV1QF411r7vi?from=search
【品城记】这家老字号粤菜饭店的人气十几年不减，它的出品真有那么好吗？,11.0万,,2018/7/26,品城记Video,www.bilibili.com/video/BV1ds411P7V2?from=search
在年销售额177亿的商场吃顿粤菜，以为差点不够钱结账！,15.2万,,2021/5/19,无所尉吃什么,www.bilibili.com/video/BV1m64y1d7Gx?from=search
老广的饭堂人均30吃地道粤菜！,2.0万,,2022/7/18,广州美食攻略V,www.bilibili.com/video/BV14d4y1Q7DR?from=search
这家上海的粤菜馆，广东人都直呼猴赛雷！,3.6万,,2021/7/17,VVVIP史蒂文,www.bilibili.com/video/BV1jK4y1u7bS?from=search
利苑—曾经的粤菜黄埔军校，现如今菜做的怎么样,21.2万,,2022/11/11,特厨魏味-,www.bilibili.com/video/BV1Cg411s7aC?from=search
香港一家四口的日常｜晚餐vlog｜家常粤菜｜腐竹鱼头煲｜苦瓜炒牛肉｜白切鸡｜上汤菠菜,21.1万,,2022/3/5,莫默mok,www.bilibili.com/video/BV1TT4y1D7iP?from=search
【广州日航酒店桃李酒家五星级粤菜】484元 （总厨徐嘉乐）,5.2万,,2022/3/3,陈随便778,www.bilibili.com/video/BV1da4118726?from=search
沈阳有名的高端粤菜店，懂的来看看这个粤菜做的正宗吗？,6.4万,,2023/6/19,胖虎老刘,www.bilibili.com/video/BV1WP411q73u?from=search
129一位的粤菜自助，一条鱼就回本！海鲜点心随便吃！,48.3万,,2022/11/15,女胖胖,www.bilibili.com/video/BV1WP411g7ey?from=search
这道顶级粤菜，生猛！,4.7万,,2018/7/19,想象视频,www.bilibili.com/video/BV11s411E749?from=search
寻味广州:星苑饭店（老字号传统粤菜风味（自称））粤式大排档,3682,,2022/5/6,李纯洁与何天真,www.bilibili.com/video/BV1A5411d7mE?from=search
广州白云区排名第一的粤菜，现场热闹得跟办酒席一样,9.3万,,2023/4/6,大兵探店,www.bilibili.com/video/BV1Ks4y1K7Ug?from=search
108道粤菜份量无限续，每道只要1圆! 自助餐老板到底靠啥盈利？,7.0万,,2022/1/7,闪电阿尧,www.bilibili.com/video/BV1Y44y1j71C?from=search
我也有被教育的一天，还有人记得炒饭粉丝吗？！看看除了粤菜乐哥还会点啥？,15.2万,,2022/3/29,厨师徐嘉乐,www.bilibili.com/video/BV1VS4y1m7Pm?from=search
济南人均50元的粤菜馆,1.1万,,2023/4/15,周嘻嘻和王哈哈,www.bilibili.com/video/BV1Fo4y1h7RC?from=search
米其林级别的宝藏粤菜店！赤酱浓油超下饭，帅小伙爽爽吃！,3.4万,,2023/9/7,赤赤吃啥呢,www.bilibili.com/video/BV1HP411a75d?from=search
240元半只的上海最嫩炸鸡，繁华闹市中的顶级粤菜餐厅，到底有多好吃？,40.6万,,2021/6/14,渣叔爱酒,www.bilibili.com/video/BV1Ry4y1u7ws?from=search
隋卞一探 |顺峰一直是北京粤菜绕不过去的名字，真是水平到底怎么样？特厨带你一探究竟！,74.7万,,2022/11/15,特厨隋卞,www.bilibili.com/video/BV1sg411q78k?from=search
开在北京蕞贵商场SKP，连续三年米其林的粤菜「北京厨房」，到底怎么样？,14.7万,,2022/10/19,JASON刘雨鑫,www.bilibili.com/video/BV1kW4y1J7ww?from=search
广州人均1500的粤菜Omakase天花板，居然让人吃石头？,11.1万,,2021/7/30,我就翻一下,www.bilibili.com/video/BV1Rf4y157PR?from=search
老广的饭堂人均30吃地道粤菜！,2.0万,,2022/7/18,广州美食攻略V,www.bilibili.com/video/BV14d4y1Q7DR?from=search
挖到宝了，这家粤菜便宜到“毫无人性”,5.0万,,2023/6/15,大兵探店,www.bilibili.com/video/BV1vo4y177MX?from=search
被中国“好男人”承包一周做饭不重样！三天后，算了，出去吃吧！粤菜！,12.5万,,2021/5/28,晓贞三件事,www.bilibili.com/video/BV19f4y1h7h6?from=search
挑战500做一星期中华8大菜系美食（第二天 粤菜）,23.9万,,2021/10/4,派大林小小厨,www.bilibili.com/video/BV1ZL411s7wt?from=search
广州最贵的粤菜，人均3000起！,28.8万,,2022/8/8,挑爷评美食,www.bilibili.com/video/BV1dd4y127SL?from=search
澳门??最难预订的米其林三⭐粤菜馆‼️,5.7万,,2022/11/10,常戴夫,www.bilibili.com/video/BV1Ud4y1r7B9?from=search
老粤菜馆里常常能见到这道咸菜煲粉肠，很经典！能吃菜能喝汤，正,5.8万,,2023/5/18,主厨农国栋,www.bilibili.com/video/BV1WV4y16782?from=search
深藏在批发市场的三十年老牌粤菜，不仅做着广州最原始的桑拿菜，被称为十大名鸡之一的“真味鸡”也相当出众。,32.0万,,2023/5/8,NAV看广州B站版,www.bilibili.com/video/BV1Uo4y1c7x7?from=search
【广州日航酒店桃李酒家五星级粤菜】484元 （总厨徐嘉乐）,5.2万,,2022/3/3,陈随便778,www.bilibili.com/video/BV1da4118726?from=search
129一位的粤菜自助，一条鱼就回本！海鲜点心随便吃！,48.3万,,2022/11/15,女胖胖,www.bilibili.com/video/BV1WP411g7ey?from=search
【广州十粤风光粤菜放题】288元 金鸽佛跳墙,8.8万,,2022/8/31,陈随便778,www.bilibili.com/video/BV1Ke4y1Y75T?from=search
这道顶级粤菜，生猛！,4.7万,,2018/7/19,想象视频,www.bilibili.com/video/BV11s411E749?from=search
广州白云区排名第一的粤菜，现场热闹得跟办酒席一样,9.3万,,2023/4/6,大兵探店,www.bilibili.com/video/BV1Ks4y1K7Ug?from=search
米其林级别的宝藏粤菜店！赤酱浓油超下饭，帅小伙爽爽吃！,3.4万,,2023/9/7,赤赤吃啥呢,www.bilibili.com/video/BV1HP411a75d?from=search
240元半只的上海最嫩炸鸡，繁华闹市中的顶级粤菜餐厅，到底有多好吃？,40.6万,,2021/6/14,渣叔爱酒,www.bilibili.com/video/BV1Ry4y1u7ws?from=search
南方女婿带东北岳父体验粤菜，岳父：这菜我下不了酒,28.0万,,2022/7/16,纪实小马,www.bilibili.com/video/BV1TV4y1J7yg?from=search
隋卞一探 |顺峰一直是北京粤菜绕不过去的名字，真是水平到底怎么样？特厨带你一探究竟！,74.7万,,2022/11/15,特厨隋卞,www.bilibili.com/video/BV1sg411q78k?from=search
中国粤菜黄埔军校！杨枝甘露就是这里发明的,3.0万,,2023/6/12,一念超人,www.bilibili.com/video/BV1Bk4y1n7tW?from=search
开在北京蕞贵商场SKP，连续三年米其林的粤菜「北京厨房」，到底怎么样？,14.7万,,2022/10/19,JASON刘雨鑫,www.bilibili.com/video/BV1kW4y1J7ww?from=search
被中国“好男人”承包一周做饭不重样！三天后，算了，出去吃吧！粤菜！,12.5万,,2021/5/28,晓贞三件事,www.bilibili.com/video/BV19f4y1h7h6?from=search
香港一家四口的日常晚餐｜粤菜里有名的咸鱼茄子煲，好吃又下饭,9.7万,,2021/6/7,莫默mok,www.bilibili.com/video/BV1q44y167xU?from=search
粤菜 我认为是最好吃的菜系之一，养生又美味,2030,,2023/3/20,鹿然-,www.bilibili.com/video/BV12X4y1Z7st?from=search
挖到宝了，这家粤菜便宜到“毫无人性”,5.0万,,2023/6/15,大兵探店,www.bilibili.com/video/BV1vo4y177MX?from=search
在广州唯一米其林二星吃饭！一盘菜就要118元，真的是粤菜最高水平吗？,13.6万,,2020/7/22,好滴多仔,www.bilibili.com/video/BV1HK411J7p2?from=search
挑战500做一星期中华8大菜系美食（第二天 粤菜）,23.9万,,2021/10/4,派大林小小厨,www.bilibili.com/video/BV1ZL411s7wt?from=search
广州最贵的粤菜，人均3000起！,28.8万,,2022/8/8,挑爷评美食,www.bilibili.com/video/BV1dd4y127SL?from=search
广东粤菜全国出名，不是靠“鼓吹”！而是粤菜有自己烹饪和定律！,2549,,2022/12/22,肥总驾到,www.bilibili.com/video/BV128411n75a?from=search
这家私房粤菜可真是“闷声做大菜”啊～,89.6万,,2023/5/22,玲子reiko-,www.bilibili.com/video/BV1hs4y1q7Jr?from=search
百年建筑里的私房粤菜——黑松露脆皮湛江鸡,6.5万,,2023/4/17,常戴夫,www.bilibili.com/video/BV1WM411L79a?from=search
【上海】99元的粤菜自助！大黄鱼畅吃！,28.3万,,2022/12/18,就是气气,www.bilibili.com/video/BV16A411Q7UD?from=search
影视里八大菜系美食：粤菜白切鸡、闽菜佛跳墙，看着就好好吃,6293,,2023/9/16,影视爱盘点,www.bilibili.com/video/BV1WF411k7Lm?from=search
中国粤菜黄埔军校！杨枝甘露就是这里发明的,3.0万,,2023/6/12,一念超人,www.bilibili.com/video/BV1Bk4y1n7tW?from=search
值得一看，5000元吃了顿非常有创意的粤菜料理【挑爷贵系列】,38.2万,,2020/9/10,挑爷评美食,www.bilibili.com/video/BV1rK411K7hR?from=search
我在广州闪现次数最多的老牌儿粤菜，它家不少菜品在我心里排位都很高，香椒盐富贵虾目前为止依然是我心中广州赖尿虾的头牌。,13.8万,,2023/5/23,NAV看广州B站版,www.bilibili.com/video/BV1Xh4y1t76K?from=search
来广州粤菜必吃这道猪手！,26,,2022/4/11,做饭给你吃-,www.bilibili.com/video/BV1Uq4y1a7S4?from=search
内地第一家拿到米其林三星的粤菜，澳龙卖到2000一斤？！到底有什么道理啦！,18.8万,,2023/6/7,好滴多仔,www.bilibili.com/video/BV1D14y1U73b?from=search
人均50元吃粤菜!,708,,2022/12/10,老刘反内卷食记,www.bilibili.com/video/BV1q44y1m79S?from=search
粤菜也有Omakase？大冤种套餐Get！,103.8万,,2022/3/13,粤知一二,www.bilibili.com/video/BV1c34y187Mu?from=search
排了一小时才吃上的上海热门粤菜餐厅—繁楼,75.4万,,2023/6/9,真探高文麒,www.bilibili.com/video/BV1j14y1Q7zp?from=search
嗯～这家的鲍鱼有味道！粤菜翠园，厨子来探店了！｜真探来了,88.4万,,2021/9/23,真探来了,www.bilibili.com/video/BV1q44y147iQ?from=search
【品城记】长这么大还是第一次听说“番禺菜”，本以为只是普通粤菜，没想到第一口就被惊艳到了！,14.9万,,2023/4/3,品城记本地版,www.bilibili.com/video/BV1La4y1M7Lu?from=search
听说你喜欢吃粤菜？今天教你个小秘诀！啫啫煲～,25.9万,,2023/4/7,安秋金,www.bilibili.com/video/BV1Tc411s7Vh?from=search
老广说不吃它等于没吃过粤菜,4.2万,,2021/11/14,阿飞姐姐_,www.bilibili.com/video/BV1xv411M7HE?from=search
【品城记】这家老字号粤菜饭店的人气十几年不减，它的出品真有那么好吗？,11.0万,,2018/7/26,品城记Video,www.bilibili.com/video/BV1ds411P7V2?from=search
做粤菜的北京厨房，skp可真是不敢多去啊｜真探来了,65.9万,,2022/5/19,真探来了,www.bilibili.com/video/BV1pF411L7Ad?from=search
【咩啊】粤菜特色：名字花里胡哨,11.6万,,2021/12/3,咩啊博士,www.bilibili.com/video/BV1b44y1h7Ej?from=search
南方女婿带东北岳父体验粤菜，岳父：这菜我下不了酒,28.0万,,2022/7/16,纪实小马,www.bilibili.com/video/BV1TV4y1J7yg?from=search
71层高空粤菜，连续4年米其林1星，¥98的虾饺就这？| 愉粤轩【肉老师探店】,7.9万,,2022/3/12,热心市民肉老师,www.bilibili.com/video/BV1pS4y1u7jc?from=search
3300一位的粤菜？预算超支警告：吃完这一顿，国庆家里蹲！,24.9万,,2021/9/30,奇异小北,www.bilibili.com/video/BV1vQ4y1Q7sn?from=search
《粤菜餐厅变成全国连锁后》其实出了广东后，连锁粤菜是唯一的精神寄托~,22.0万,,2023/9/8,大头泽子,www.bilibili.com/video/BV1u14y1C7XK?from=search
香港一家四口的日常晚餐｜粤菜里有名的咸鱼茄子煲，好吃又下饭,9.7万,,2021/6/7,莫默mok,www.bilibili.com/video/BV1q44y167xU?from=search
138元/位的粤式自助，几十种蒸点粤菜不限量！部分菜品还有待提升噢~(下),14.6万,,2023/5/10,温油辣辣U,www.bilibili.com/video/BV1rs4y1D7NE?from=search
这家被称为中年男性避风塘的粤菜馆，居然自己承认不好吃——金鼎轩,15.2万,,2023/4/21,特厨魏味-,www.bilibili.com/video/BV1Pa4y1N7Ev?from=search
成都人均200元的粤菜餐厅，得过金奖的乳鸽能有多绝！菜量大适合聚餐~,15.6万,,2023/6/7,温油辣辣U,www.bilibili.com/video/BV1yX4y1t7bp?from=search
【广州十粤风光粤菜放题】288元 金鸽佛跳墙,8.8万,,2022/8/31,陈随便778,www.bilibili.com/video/BV1Ke4y1Y75T?from=search
【新穗港龙粤菜馆】这家正宗的粤菜馆，卖烧鹅相当实惠,29.6万,,2019/1/2,康康吃一口,www.bilibili.com/video/BV1rt411z7Fn?from=search
美国丈母娘第一次吃粤菜，被烧腊打动：我就是一个广东女孩！,35.7万,,2022/7/17,田纳西Jay和Ari,www.bilibili.com/video/BV1pU4y1i7vB?from=search
带美国岳父母在中餐馆吃粤菜，吃完丈母娘说我本来不喜欢鸭肉的！,23.0万,,2022/12/17,田纳西Jay和Ari,www.bilibili.com/video/BV1de4y1K7YA?from=search
在广州唯一米其林二星吃饭！一盘菜就要118元，真的是粤菜最高水平吗？,13.6万,,2020/7/22,好滴多仔,www.bilibili.com/video/BV1HK411J7p2?from=search
中午去静安寺吃“食好点”粤菜点心,7.3万,,2021/1/24,丁子沪,www.bilibili.com/video/BV1Bh411y7mD?from=search
用粤菜&quot;豆豉蒸排骨&quot;PK西班牙徒弟的拿手好菜&quot;烤排骨&quot;，究竟谁能笑到最后,40.5万,,2023/3/7,西班牙陈挺,www.bilibili.com/video/BV1MX4y1Q751?from=search
广东人是因为太穷了，所以导致粤菜上不了国宴！,19.5万,,2023/4/15,爆梗体坛,www.bilibili.com/video/BV1rs4y1P7Hs?from=search
无刺金汤东星斑！高颜值粤菜点心火力全开｜成都探店,73.8万,,2020/7/22,密子君,www.bilibili.com/video/BV1ia4y1a7P1?from=search
某点评排名第五的北京粤菜馆，生啫居然吃出了老北京炸酱面味——粤小馆,8.4万,,2023/8/9,特厨魏味-,www.bilibili.com/video/BV1Bj411z7LF?from=search
八大菜系，粤菜为王,3481,,2021/12/29,嗷嗷嗷的小西纸,www.bilibili.com/video/BV1Rq4y1m7iZ?from=search
吃货老外最爱的7个粤菜,48.0万,,2016/6/18,TrevorJames吃货老外,www.bilibili.com/video/BV19s411e7Nz?from=search
【广州十粤风光粤菜放题】288元 金鸽佛跳墙,8.8万,,2022/8/31,陈随便778,www.bilibili.com/video/BV1Ke4y1Y75T?from=search
【新穗港龙粤菜馆】这家正宗的粤菜馆，卖烧鹅相当实惠,29.6万,,2019/1/2,康康吃一口,www.bilibili.com/video/BV1rt411z7Fn?from=search
在广州唯一米其林二星吃饭！一盘菜就要118元，真的是粤菜最高水平吗？,13.6万,,2020/7/22,好滴多仔,www.bilibili.com/video/BV1HK411J7p2?from=search
中午去静安寺吃“食好点”粤菜点心,7.3万,,2021/1/24,丁子沪,www.bilibili.com/video/BV1Bh411y7mD?from=search
用粤菜&quot;豆豉蒸排骨&quot;PK西班牙徒弟的拿手好菜&quot;烤排骨&quot;，究竟谁能笑到最后,40.5万,,2023/3/7,西班牙陈挺,www.bilibili.com/video/BV1MX4y1Q751?from=search
广东人是因为太穷了，所以导致粤菜上不了国宴！,19.5万,,2023/4/15,爆梗体坛,www.bilibili.com/video/BV1rs4y1P7Hs?from=search
某点评排名第五的北京粤菜馆，生啫居然吃出了老北京炸酱面味——粤小馆,8.4万,,2023/8/9,特厨魏味-,www.bilibili.com/video/BV1Bj411z7LF?from=search
八大菜系，粤菜为王,3481,,2021/12/29,嗷嗷嗷的小西纸,www.bilibili.com/video/BV1Rq4y1m7iZ?from=search
吃货老外最爱的7个粤菜,48.0万,,2016/6/18,TrevorJames吃货老外,www.bilibili.com/video/BV19s411e7Nz?from=search
吃粤菜不得不提佛跳墙，就是量不够吃···,126.0万,,2022/12/12,玲子reiko-,www.bilibili.com/video/BV1fW4y1M7iR?from=search
粤点粤菜粤精彩，经典粤菜生炒骨，这个生炒骨手势如何？广州江燕南路原汁原味农家鸡,2557,,2022/5/10,Amy爱你的每一天,www.bilibili.com/video/BV1pY411c753?from=search
还原80年代经典粤菜！先腌再炸最后焖，明油亮芡看着就香~丨百花迎春鸡,29.1万,,2023/2/3,老饭骨,www.bilibili.com/video/BV1TT411X7J9?from=search
挂羊头卖狗肉？在粤菜馆点3瓶酒比整桌菜还贵！,54.8万,,2020/8/17,吃货请闭眼,www.bilibili.com/video/BV1c5411h7vf?from=search
粤菜 我认为是最好吃的菜系之一，养生又美味,2030,,2023/3/20,鹿然-,www.bilibili.com/video/BV12X4y1Z7st?from=search
从江边大排档到米其林，这家粤菜有多好吃？,1.8万,,2021/11/4,肥仔_旅游ing,www.bilibili.com/video/BV19u411o72K?from=search
八大菜系之粤菜,210,,2021/7/7,一无是处的狠人,www.bilibili.com/video/BV1RK4y1M74y?from=search
10分钟能做什么粤菜大餐？,422,,2021/7/16,赵胤胤YIN-YIN,www.bilibili.com/video/BV1gy4y1T7vr?from=search
粤菜，总是有着我一个江湖厨师觉得深不可测的经典！最后你们看懂了吗？,19.5万,,2023/1/5,涛哥教家常菜,www.bilibili.com/video/BV1e84y1e7Wg?from=search
淮扬菜和粤菜谁更甚一筹？,25.5万,,2022/2/12,叨叨傅吐槽秀,www.bilibili.com/video/BV1XR4y157iN?from=search
最好吃的乳鸽居然不在粤菜馆！？,2.7万,,2022/3/12,史丹利没吃饱,www.bilibili.com/video/BV14U4y1o7Ho?from=search
这家粤菜店，在我心目中还是有一席之地的,455,,2023/7/29,天才少年扬州神,www.bilibili.com/video/BV1LP41167pW?from=search
跟大师傅学做一道有名的特色粤菜 生炒鱼片！,14.6万,,2022/12/16,账号已注销,www.bilibili.com/video/BV1qA41197TM?from=search
这家粤菜馆子，怎么会和印象里差别这么大？|真探来了,41.5万,,2022/11/11,真探来了,www.bilibili.com/video/BV1S8411b7Mf?from=search
下班找个性价比高的粤菜馆干饭，喝口广东靓汤再吃口煲仔饭，生活安逸,1.2万,,2023/9/12,广东帅气男孩,www.bilibili.com/video/BV1zV411P7tX?from=search
盐焗鸡惊呆芬兰家人！碌鸭让他们彻底爱上粤菜！芬兰家人: 这是中国皇帝才能吃到的顶级美食吧？？！,142.9万,,2022/3/7,雨琪在芬兰,www.bilibili.com/video/BV1mi4y1k7ZC?from=search
米其林1星粤菜馆「紫金阁」天价炒河粉猜猜多少?,14.8万,,2022/9/3,JASON刘雨鑫,www.bilibili.com/video/BV1cD4y1z7aM?from=search
一个爱吃粤菜的混血小吃货,5.3万,,2023/8/19,两个中法混血儿的妈妈,www.bilibili.com/video/BV1X94y167pG?from=search
【品城记】连续7次获得米其林推荐的港式粤菜馆，招牌菜竟然是“担担面”？,8.0万,,2018/12/15,品城记Video,www.bilibili.com/video/BV1st411i7y3?from=search
这家的牌子有点儿多啊，好评如潮的粤菜馆炳胜品味今天来吃吃｜真探来了,50.2万,,2022/2/8,真探来了,www.bilibili.com/video/BV1M34y127oB?from=search
江西老表开粤菜馆，谁家往白切鸡里浇辣椒，吃个饭真的想报警。,15.8万,,2023/8/23,有糖娱乐,www.bilibili.com/video/BV1pp4y1n7Aq?from=search
八大菜系之粤菜,210,,2021/7/7,一无是处的狠人,www.bilibili.com/video/BV1RK4y1M74y?from=search
从江边大排档到米其林，这家粤菜有多好吃？,1.8万,,2021/11/4,肥仔_旅游ing,www.bilibili.com/video/BV19u411o72K?from=search
第一次吃粤菜,5383,,2023/7/24,一只糊弄猪,www.bilibili.com/video/BV1aP411r7Ms?from=search
结婚周年纪念日来吃一下潮上潮，这家是不是差不多北京粤菜价格天花板了…感觉不是特别值～,8406,,2023/9/10,瑭瑭的日记本,www.bilibili.com/video/BV1ck4y1P7rX?from=search
VLOG|吃垮广州快闪一天 狂吃甜品咖啡打卡8家店 粤菜吃太饱了！也太开心啦！！！美食日记探店日常,16.7万,,2022/1/21,我是一颗梨,www.bilibili.com/video/BV1ZS4y1d7WZ?from=search
高端粤菜再加价，凭啥？,324,,2023/2/22,poppinmanlx,www.bilibili.com/video/BV1cR4y1B7eH?from=search
舌尖上的粤菜,163,,2019/3/22,想当村花的小何师傅,www.bilibili.com/video/BV1Lb41177Xy?from=search
这间口碑爆棚的粤菜小馆，每天只做三桌，让你享受30秒极致美味,4.6万,,2017/8/17,一念翡翠,www.bilibili.com/video/BV1xx411J7nP?from=search
粤菜，总是有着我一个江湖厨师觉得深不可测的经典！最后你们看懂了吗？,19.5万,,2023/1/5,涛哥教家常菜,www.bilibili.com/video/BV1e84y1e7Wg?from=search
纽约探店一日游！据说这是纽约粤菜天花板？？,78.2万,,2022/10/30,拿拿nah,www.bilibili.com/video/BV1ye411G7Zn?from=search
江西老表开粤菜馆，谁家往白切鸡里浇辣椒，吃个饭真的想报警。,15.8万,,2023/8/23,有糖娱乐,www.bilibili.com/video/BV1pp4y1n7Aq?from=search
【粤菜】粤菜,102,,2021/9/22,粤菜介绍,www.bilibili.com/video/BV19L411W7QK?from=search
舌尖上的粤菜,163,,2019/3/22,想当村花的小何师傅,www.bilibili.com/video/BV1Lb41177Xy?from=search
来晓粤 品惹味粤菜,139,,2023/3/3,MrWongwong,www.bilibili.com/video/BV1uY411678Q?from=search
粤菜大曝光,210,,2023/7/18,中山有食神,www.bilibili.com/video/BV1oV411N7uP?from=search
纽约探店一日游！据说这是纽约粤菜天花板？？,78.2万,,2022/10/30,拿拿nah,www.bilibili.com/video/BV1ye411G7Zn?from=search
《老广味道———粤菜经典，桌饭》,22.8万,,2023/4/3,Vandoorking,www.bilibili.com/video/BV1UV4y1Q7RA?from=search
隋卞一探 |利苑酒家几十年，听说出来的名厨占据了粤菜江湖的半壁江山！所以才叫粤菜黄埔！,84.5万,,2023/2/10,特厨隋卞,www.bilibili.com/video/BV1Kv4y1473R?from=search
各种粤菜在这里真是层出不穷,17,,2022/12/1,青岛生活大全,www.bilibili.com/video/BV1oe411P7FN?from=search
据说是成都最好吃的粤菜？,1.2万,,2021/10/9,猪蛋达,www.bilibili.com/video/BV1vh411H7rS?from=search
东北人做粤菜能做特一级？,7.0万,,2023/8/15,漫剪酷酷,www.bilibili.com/video/BV1hj411B7gN?from=search
粤菜-掌上明珠,62,,2021/8/18,社会研学社,www.bilibili.com/video/BV1ZP4y1H7jb?from=search
粤菜,112,,2021/2/6,发发就发发了咯,www.bilibili.com/video/BV1py4y1Y74p?from=search
粤菜系列,31,,2020/12/31,美食链记录,www.bilibili.com/video/BV1Wv411t7ih?from=search
快乐粤菜！,60,,2023/6/26,李华28,www.bilibili.com/video/BV1KN411D7a4?from=search
