title,view_num,danmu,upload_time,up_author,video_url
粤菜必吃的八道家常菜，鲜香美味回味无穷,9.7万,,2023/9/8,饭饭教做菜,www.bilibili.com/video/BV1rh4y1v7MY?from=search
八大菜系 · 粤菜（合计100P）,19.4万,,2018/8/12,炸鸡桑,www.bilibili.com/video/BV15s411T7pq?from=search
广东粤菜姜葱鸡，肉嫩味美太好吃了粤菜,6.6万,,2023/2/20,樊先生美食分享美食,www.bilibili.com/video/BV1xs4y1h7uX?from=search
粤菜生蚝鸡煲，鸡肉超香，生蚝大大粒超鲜甜！天气冷就想吃煲仔菜！,84.8万,,2021/12/30,澳门厨房佬,www.bilibili.com/video/BV1tZ4y1D778?from=search
经典粤菜白灼鱿鱼，教大家切三丝，过年摆盘总要美美的。简单调味的白灼汁就能做出鲜味的鱿鱼,33.9万,,2022/1/7,澳门厨房佬,www.bilibili.com/video/BV19Y411a7Su?from=search
沙姜猪手，我称之为粤菜经典。澳门厨房佬觉得这个菜相当适合夏天,51.1万,,2022/4/12,澳门厨房佬,www.bilibili.com/video/BV1nT4y1Y7er?from=search
粤菜神仙做法，鲜嫩多汁，怎么吃都不够,1.3万,,2023/2/23,嘟嘟栗子酱,www.bilibili.com/video/BV14o4y1Y7cx?from=search
《大厨家常菜-粤菜》,5199,,2021/8/6,账号已注销,www.bilibili.com/video/BV16M4y157KU?from=search
粤菜“鱿鱼鲜虾煲”，天冷了吃上一锅热乎乎的，特幸福,30.1万,,2020/10/21,小武哥美食厨房,www.bilibili.com/video/BV1Ry4y1b7Ky?from=search
老牌粤菜酒楼-广州酒家｜真探来了,45.4万,,2021/12/29,真探来了,www.bilibili.com/video/BV1hq4y117VX?from=search
在广东鸡肉的做法有千百种，我认为最好吃的做法，就是沙姜葱油焖鸡了，又香又嫩～ #沙姜葱油鸡 #粤菜,12.3万,,2023/8/29,谁知盘中餐7,www.bilibili.com/video/BV1nj411273w?from=search
粤菜的文化,1619,,2022/5/19,中言真美爱,www.bilibili.com/video/BV18Y4y1z7Dk?from=search
【粤菜】八大菜系为首的粤菜打河基本功,1.8万,,2021/12/4,粤菜介绍,www.bilibili.com/video/BV1xq4y1z74f?from=search
广东白斩鸡，粤菜大厨教你做最正宗广东白斩鸡,7.2万,,2021/5/24,粤厨八哥,www.bilibili.com/video/BV1Eo4y117q6?from=search
吐血整理45家私藏老广粤菜，广州美食必打卡粤菜集,3.3万,,2023/9/13,大兵探店,www.bilibili.com/video/BV15k4y1w7LV?from=search
【大师的菜·干炒牛河】亚洲十大名厨亲掌勺，展现粤菜厨房克星“干炒牛河”，香气十足！,81.5万,,2019/4/23,大师的菜,www.bilibili.com/video/BV1Lb411G7BS?from=search
《粤菜密码》首发，揭秘广东菜为何如此好吃！,2241,,2021/10/24,广东卫视,www.bilibili.com/video/BV1yq4y1G7Bu?from=search
【粤菜】中国八大菜系之粤菜，粤菜十大代表菜上集，喜欢粤菜的朋友，看过来,7359,,2021/10/2,粤菜介绍,www.bilibili.com/video/BV1oL411W7gb?from=search
【粤菜】如果你来广东，这道广东特色菜，芥蓝炒牛肉是值得一吃的,3.1万,,2021/11/24,粤菜介绍,www.bilibili.com/video/BV1RR4y1x7Aa?from=search
一次性解锁三种粤式青菜的做法！蚝油生菜|豆豉鲮鱼油麦菜|上汤菠菜,63.5万,,2022/11/15,麦子小满kitchen,www.bilibili.com/video/BV14P4y1178z?from=search
菜谱-粤菜100道,1657,,2020/6/20,PQup,www.bilibili.com/video/BV1hK411n7pX?from=search
一次性解锁三种粤式青菜的做法！蚝油生菜|豆豉鲮鱼油麦菜|上汤菠菜,63.5万,,2022/11/15,麦子小满kitchen,www.bilibili.com/video/BV14P4y1178z?from=search
澳门厨房佬粤菜豉油鸡，酱香浓郁，满屋飘香！粉丝点菜！广东名菜！,47.7万,,2021/7/18,澳门厨房佬,www.bilibili.com/video/BV1Hf4y157xt?from=search
能代表粤菜的蔬菜做法，盐水菜心算一个。,1.2万,,2022/8/15,光头师傅美食,www.bilibili.com/video/BV1ue4y1f7qQ?from=search
粤菜五柳炸蛋：外焦里嫩，看着都香，酸甜开胃又营养，好吃不油腻,6.4万,,2020/7/26,我是马小坏,www.bilibili.com/video/BV1YK411J7eH?from=search
北京饭店粤菜泰斗康辉-豆豉青椒炒牛肉,2.4万,,2023/9/11,城故北199,www.bilibili.com/video/BV1f34y1N743?from=search
【大师的菜·煎虾饼】在家也能自制的广式点心—虾饼，弹牙爽口，粤菜大厨步步教做！,38.0万,,2019/5/3,大师的菜,www.bilibili.com/video/BV1f441147pf?from=search
粤菜生啫鸡煲的做法，鲜嫩美味够锅气，跟在饭店吃的一样香,11.7万,,2020/8/1,美食一线陈仔,www.bilibili.com/video/BV1Tp4y1q79j?from=search
粤菜里面的蜜汁烧排骨，在家做其实也是很简单的，你们这次一定能学会,96.7万,,2021/11/5,澳门厨房佬,www.bilibili.com/video/BV13f4y1u7sQ?from=search
粤菜菜谱大全烹饪视频教程,7519,,2019/4/6,Selfemancipation,www.bilibili.com/video/BV1Tb41137V2?from=search
已经吃不到的口福鸡！乐哥带你重拾逝去的粤菜经典味道！,420.3万,,2022/6/26,厨师徐嘉乐,www.bilibili.com/video/BV1yN4y1u7BE?from=search
整鸡去皮，酿入虾胶，这是粤菜巅峰之作江南百花鸡,44.0万,,2022/5/31,唐师傅炒菜爱放糖,www.bilibili.com/video/BV1a341137fw?from=search
【品城记】东莞│又被我们挖到一家东莞的宝藏小店！几道独创的粤菜全都做得有滋有味！,14.8万,,2020/9/14,品城记本地版,www.bilibili.com/video/BV1DA411E7tB?from=search
味‧道 - 粤菜,9153,,2019/6/8,MeowFET,www.bilibili.com/video/BV1T4411T7tq?from=search
广东必学的家常菜之一！粉丝吸收整道菜的精华！细节都教你了，这个虾米节瓜粉丝煲你没理由不会！#粤菜 #厨师 #粉丝煲,46.4万,,2023/9/1,厨师徐嘉乐,www.bilibili.com/video/BV1H94y147HM?from=search
"咕嚕肉，也可以稱為古老肉、是一道粵菜，在马来西亚，古老肉是最普遍的美食之一, 男女老幼都爱吃！到餐馆常常会点这道古老肉用餐，甜中带点酸味让人特别开胃！",4.1万,,2021/9/23,表弟好煮意,www.bilibili.com/video/BV1w34y1D76m?from=search
粤菜名酱之一的“煲仔酱”，适合烹饪任何鸡鸭鹅等肉类。大厨今天毫无保留分享给大家,5140,,2023/8/29,广东仔一鸡昌,www.bilibili.com/video/BV1yh4y127qc?from=search
【综艺】粤菜好师傅 第二季(2022)[11集] 好看又好玩的粤菜美食厨艺大赏,3734,,2022/10/18,熊猫大侠阿,www.bilibili.com/video/BV17P411N7XJ?from=search
【品城记】爱了！这家粤菜就是广东人熟悉的味道！姜油浸蛙真的特别！,17.8万,,2023/1/27,品城记本地版,www.bilibili.com/video/BV1q84y177Wr?from=search
粤菜南乳排骨的懒人做法，看着都香，配点小酒太解馋了,4.0万,,2020/6/16,我是马小坏,www.bilibili.com/video/BV1ii4y1x71e?from=search
整鸡去皮，酿入虾胶，这是粤菜巅峰之作江南百花鸡,44.0万,,2022/5/31,唐师傅炒菜爱放糖,www.bilibili.com/video/BV1a341137fw?from=search
见红不见血，这才是粤菜白切鸡的传统做法,5.4万,,2022/4/7,唐师傅炒菜爱放糖,www.bilibili.com/video/BV1Y94y1Z7jj?from=search
粤菜白灼大虾，马上过年了，澳门厨房佬教你这个简单的白灼汁做法，点大虾鲜甜又美味,40.7万,,2022/1/1,澳门厨房佬,www.bilibili.com/video/BV1Sr4y1m7zF?from=search
粤菜里面的蜜汁烧排骨，在家做其实也是很简单的，你们这次一定能学会,96.7万,,2021/11/5,澳门厨房佬,www.bilibili.com/video/BV13f4y1u7sQ?from=search
久违的经典怀旧粤菜大集合！传统粤式老味道叫人难忘，越秀这家不起眼街坊餐厅有两下子,8.7万,,2023/4/22,毛毛美食指南,www.bilibili.com/video/BV1rT411n7N2?from=search
粤菜的经典名菜,455,,2022/5/18,中言真美爱,www.bilibili.com/video/BV1eY4y1t78M?from=search
广东常见的一道经典粤菜‘豉油鸡’记住这个配方，学会就可以开店,19.8万,,2021/8/10,梁福来,www.bilibili.com/video/BV15o4y1D7wH?from=search
【品城记】东莞│又被我们挖到一家东莞的宝藏小店！几道独创的粤菜全都做得有滋有味！,14.8万,,2020/9/14,品城记本地版,www.bilibili.com/video/BV1DA411E7tB?from=search
经典粤菜菠萝咕咾肉，梦回1980，酸甜适中，酥脆可口！,13.1万,,2020/12/29,老饭骨品牌,www.bilibili.com/video/BV1Ha4y1p7vY?from=search
中国八大菜系之粤菜，粤菜十大名菜，您知道几个？又吃过几个？,7902,,2021/12/27,粤菜介绍,www.bilibili.com/video/BV1kL4y1n7ka?from=search
粤点粤菜粤精彩，三分钟蒸鸡，顺德大厨手把手教你做蒸鸡，粤语中字幕,3.2万,,2022/12/19,Amy爱你的每一天,www.bilibili.com/video/BV1ER4y167yS?from=search
粤菜厨师长教你做一道“姜葱炒蟹”，味道非常正宗,30.8万,,2019/7/20,主厨农国栋,www.bilibili.com/video/BV1xt411n7Pi?from=search
大湾区经典菜豉油鸡，粤菜老师傅是这样子做的,5.8万,,2022/3/24,唐师傅炒菜爱放糖,www.bilibili.com/video/BV1f44y1N7No?from=search
一开盖满屋飘香的生蚝鸡煲，鸡肉鲜香嫩滑，生蚝肥美。 #生蚝鸡煲 #粤菜 #妈呀太香啦,1.6万,,2023/9/18,谁知盘中餐7,www.bilibili.com/video/BV1oC4y1f7d7?from=search
原来正宗粤菜这么好吃！韩国小哥在中国刷新之前粤菜体验,60.1万,,2023/7/14,Iam小方,www.bilibili.com/video/BV1Pj411f7Eo?from=search
粤菜大厨教你一道“砂锅鱼头”，记住这3点做出鲜.嫩.滑的鱼头煲,23.0万,,2019/7/26,主厨农国栋,www.bilibili.com/video/BV1Zt411j7w6?from=search
味‧道 - 粤菜,9153,,2019/6/8,MeowFET,www.bilibili.com/video/BV1T4411T7tq?from=search
越秀二十多年的实惠街坊粤菜，招牌脆皮大肠堪称经典，菜价平均三四十平靓正到家,12.3万,,2022/3/30,毛毛美食指南,www.bilibili.com/video/BV1TZ4y1z7XJ?from=search
广东粤菜经典酱油鸡，记住这个做法，皮爽肉滑鲜香入味，简单家常,3.6万,,2021/11/4,尬瓜美食厨房,www.bilibili.com/video/BV1g44y1i7uu?from=search
来上海不吃本帮菜，粤菜才是真一绝！,11.0万,,2021/8/9,本人曲献平,www.bilibili.com/video/BV1sb4y1z7VP?from=search
越秀二十多年的实惠街坊粤菜，招牌脆皮大肠堪称经典，菜价平均三四十平靓正到家,12.3万,,2022/3/30,毛毛美食指南,www.bilibili.com/video/BV1TZ4y1z7XJ?from=search
广东粤菜经典酱油鸡，记住这个做法，皮爽肉滑鲜香入味，简单家常,3.6万,,2021/11/4,尬瓜美食厨房,www.bilibili.com/video/BV1g44y1i7uu?from=search
大厨分享粤菜“XO酱海皇粉丝煲”一看就会、非常简单,14.7万,,2019/6/30,主厨农国栋,www.bilibili.com/video/BV1Nx411R7My?from=search
粤菜-豉汁啫啫粉肠煲，粤港澳惹味家常菜。喜欢吃的真的可以试一试！,9.6万,,2022/3/15,澳门厨房佬,www.bilibili.com/video/BV1JS4y1D7kp?from=search
【大师的菜·叉烧包】粤菜“点心四宝”之王—叉烧包，粤菜大厨教你做，早茶必备！,23.6万,,2019/11/1,大师的菜,www.bilibili.com/video/BV1iE411879o?from=search
【品城记in深圳】在深圳做了半年节目，这家店被姚大秋认证为最好吃的粤菜馆！,11.1万,,2019/3/29,品城记Video,www.bilibili.com/video/BV1yb411x7Q5?from=search
来上海不吃本帮菜，粤菜才是真一绝！,11.0万,,2021/8/9,本人曲献平,www.bilibili.com/video/BV1sb4y1z7VP?from=search
【品城记】爱了！这家粤菜就是广东人熟悉的味道！姜油浸蛙真的特别！,17.8万,,2023/1/27,品城记本地版,www.bilibili.com/video/BV1q84y177Wr?from=search
粤菜啫啫鸡煲大家经常去外面都喜欢点来吃，在家用电饭煲就能做了，很下饭！,12.2万,,2021/9/26,澳门厨房佬,www.bilibili.com/video/BV1uL411471w?from=search
粤菜白灼鲍鱼，年夜菜的第三道菜来了，年夜饭少不了的鲍鱼，简单的做法就很鲜味了！,8.0万,,2022/1/3,澳门厨房佬,www.bilibili.com/video/BV1gS4y1T7cS?from=search
被誉为天下第一菜的“佛跳墙”，粤菜师傅用15天时间炮制而成,562.8万,,2019/7/21,主厨农国栋,www.bilibili.com/video/BV1qt411E7Wb?from=search
广东名菜《啫啫煲》新东方教不了粤菜的原因，根本没有这等魄力,4.9万,,2021/11/15,宇宙在手命不由天,www.bilibili.com/video/BV1wL4y1i7y6?from=search
那些接地气的粤菜老广饭堂，我的广州美食地图，第三集。,25.7万,,2023/1/20,NAV看广州B站版,www.bilibili.com/video/BV1Dd4y1p75s?from=search
在家就可以复刻粤菜经典菜式咸鱼茄子煲，超级下饭又美味，不要一锅油也不要水汪汪,8.3万,,2023/5/25,小喵粑粑,www.bilibili.com/video/BV1Rs4y1q7aH?from=search
手把手教你做，粤菜万能豉油皇，豉油皇在手，让你秒变粤菜大厨,3.0万,,2023/7/11,Amy爱你的每一天,www.bilibili.com/video/BV1sh4y1Z7PW?from=search
N刷鉴定天河最平靓正的街坊粤菜馆，菜式出品传统地道且量大价平，真的是天河少有,27.2万,,2021/12/17,毛毛美食指南,www.bilibili.com/video/BV1fR4y1p7Bk?from=search
大厨分享一道粤菜经典“干炒牛河”，被誉为最考厨师功夫的一道菜,70.4万,,2019/5/27,主厨农国栋,www.bilibili.com/video/BV1K4411s7qn?from=search
【粤菜】八大菜系你中意哪个,4298,,2021/10/2,粤菜介绍,www.bilibili.com/video/BV1CP4y1b7xu?from=search
久违的高质量传统粤菜，花都这家粤菜馆吃到了对正统粤菜精髓的坚持，出品用心意犹未尽,26.9万,,2021/11/9,毛毛美食指南,www.bilibili.com/video/BV1sb4y187jH?from=search
【大师的菜·脆皮烧鸡】广东脆皮烧鸡征服万千食客，三步腌制缺一不可，粤菜名厨教你做！,24.5万,,2019/6/21,大师的菜,www.bilibili.com/video/BV1Y441137iS?from=search
广东名菜《啫啫煲》新东方教不了粤菜的原因，根本没有这等魄力,4.9万,,2021/11/15,宇宙在手命不由天,www.bilibili.com/video/BV1wL4y1i7y6?from=search
大厨分享广东经典粤菜“生炒菜心”家常炒制教程，饭桌怎能少了它,21.3万,,2019/5/29,主厨农国栋,www.bilibili.com/video/BV1t4411W7Hw?from=search
别说00后了，90后都没几个人吃过这道怀旧粤菜！,15.5万,,2022/11/18,厨师徐嘉乐,www.bilibili.com/video/BV1Sd4y1b71L?from=search
广东人因为太穷了，所以导致粤菜上不了国宴！,30.5万,,2023/4/14,肥总驾到,www.bilibili.com/video/BV1ok4y1Y7Sx?from=search
"粤菜经典的豆豉鲮鱼油麦菜,好下饭啊！",29.9万,,2022/11/16,开饭啦小志,www.bilibili.com/video/BV1mt4y1N7Dc?from=search
你是“蒸”广东人吗？2022了谁说粤菜做鱼只会清蒸？,135.5万,,2022/1/15,厨师徐嘉乐,www.bilibili.com/video/BV1sL4y1474Y?from=search
N刷鉴定天河最平靓正的街坊粤菜馆，菜式出品传统地道且量大价平，真的是天河少有,27.2万,,2021/12/17,毛毛美食指南,www.bilibili.com/video/BV1fR4y1p7Bk?from=search
大厨花5天时间只为制作一道粤菜“鲍鱼”，美味需要时间沉淀,88.7万,,2019/6/28,主厨农国栋,www.bilibili.com/video/BV1Vx411d7Am?from=search
久违的高质量传统粤菜，花都这家粤菜馆吃到了对正统粤菜精髓的坚持，出品用心意犹未尽,26.9万,,2021/11/9,毛毛美食指南,www.bilibili.com/video/BV1sb4y187jH?from=search
【大师的菜·脆皮烧鸡】广东脆皮烧鸡征服万千食客，三步腌制缺一不可，粤菜名厨教你做！,24.5万,,2019/6/21,大师的菜,www.bilibili.com/video/BV1Y441137iS?from=search
本地人才知道的老牌粤菜，据说是广州第一啫煲，独栋楼房挤满食客,5.1万,,2023/5/26,大兵探店,www.bilibili.com/video/BV1sh411c7pg?from=search
粤菜大厨分享酒店-啫啫酱，只要下5克即可让所有砂锅菜升级,26.6万,,2019/7/19,主厨农国栋,www.bilibili.com/video/BV1Mt411n7Yx?from=search
粤菜,1731,,2018/5/25,发情的秀太,www.bilibili.com/video/BV1Wp411R7i9?from=search
在上海造价148亿的大厦吃“最贵粤菜 ”经费在燃烧！1388/位,74.7万,,2020/9/28,张喜喜-,www.bilibili.com/video/BV1TA411J7eG?from=search
顶级名厨演绎极品食材，难得一见的古法粤菜！,43.8万,,2022/12/10,渣叔爱酒,www.bilibili.com/video/BV1bK41167nj?from=search
藏在天河中心区极具烟火气的街坊粤菜，出品相当地道价格远脱离天河水平，是家宝藏小店,14.4万,,2022/4/25,毛毛美食指南,www.bilibili.com/video/BV16Y4y187Xd?from=search
粤菜经典“姜葱爆生鱼片”秘诀！鱼片不散，鲜嫩爽滑，绝了！,9.9万,,2021/6/19,补王张小厨,www.bilibili.com/video/BV1mU4y157JU?from=search
八大菜系-粤菜,7207,,2018/9/1,FlatMaicc,www.bilibili.com/video/BV1iW411f7i7?from=search
换种方法做#鸡煲 鲜香味甜！#一只鸡的百种做法 #粤菜,3089,,2023/9/20,Lookocherry大徐,www.bilibili.com/video/BV16P411b7ry?from=search
经典粤菜，又香又入味蜜汁小排，它可是农师傅从厨学的第一个招牌菜,27.2万,,2023/6/15,主厨农国栋,www.bilibili.com/video/BV1214y1S71f?from=search
广东粤菜农庄，顺德名菜酿鲮鱼，烧鹅皮脆肉嫩，阿星吃广式煎堆,17.7万,,2020/11/13,阿星探店,www.bilibili.com/video/BV1r54y1z7Qv?from=search
粤菜白灼鲍鱼，年夜菜的第三道菜来了，年夜饭少不了的鲍鱼，简单的做法就很鲜味了！,8.0万,,2022/1/3,澳门厨房佬,www.bilibili.com/video/BV1gS4y1T7cS?from=search
粤菜中公认的十大名菜，你吃过几道,8301,,2022/7/5,小融吃吃吃,www.bilibili.com/video/BV17S4y1n76i?from=search
鱼还在清蒸？经典粤菜蒸麒麟鱼，滑嫩无比，那叫一个香~,39.7万,,2022/1/11,老饭骨,www.bilibili.com/video/BV1SY41187yP?from=search
广州也太好吃了吧！从糖水小吃到粤菜大餐，食在广州不得不服,6.6万,,2023/2/21,主厨广坦,www.bilibili.com/video/BV1Mx4y1F7qm?from=search
想吃耗油菜心，不用再去粤菜馆，在家只需三分钟，家常做法超简单,3.8万,,2020/12/27,天天相见厨房,www.bilibili.com/video/BV14p4y1B7LW?from=search
还原经典老粤菜，鲜爽弹滑！好吃又好看，味道叫一绝~丨百花酿带子,40.2万,,2023/3/30,老饭骨,www.bilibili.com/video/BV1ws4y1n7xp?from=search
本地人才知道的老牌粤菜，据说是广州第一啫煲，独栋楼房挤满食客,5.1万,,2023/5/26,大兵探店,www.bilibili.com/video/BV1sh411c7pg?from=search
【粤菜】八大菜系你中意哪个,4298,,2021/10/2,粤菜介绍,www.bilibili.com/video/BV1CP4y1b7xu?from=search
粤菜经典“沙姜白切猪手”！撑握秘诀，Q弹爽口，夏天开胃神菜,7.7万,,2022/7/8,补王张小厨,www.bilibili.com/video/BV1AV4y1n7Bs?from=search
粤菜里历史悠久的名肴“鱼腐”你吃过吗，家常版的做法教给大家,26.1万,,2020/10/16,主厨农国栋,www.bilibili.com/video/BV1pa4y1L7iP?from=search
粤菜泰斗来袭！带你解锁什么是最正宗的豉油王【玫瑰豉油鸡】,4.6万,,2021/6/20,厨邦大师开饭,www.bilibili.com/video/BV1iK4y1u7PS?from=search
粤菜大厨分享广东人的最爱“萝卜牛腩煲”正宗做法，你不学吗？,18.3万,,2019/3/21,打靶鬼vIog,www.bilibili.com/video/BV1Wb411J7we?from=search
经典粤菜，又香又入味蜜汁小排，它可是农师傅从厨学的第一个招牌菜,27.2万,,2023/6/15,主厨农国栋,www.bilibili.com/video/BV1214y1S71f?from=search
比咸猪手更好吃的南乳黄豆猪手 广东经典粤菜 ，强筋骨，营养好，红润酥软，好下饭,4.4万,,2021/10/24,小喵粑粑,www.bilibili.com/video/BV1dL411g7PY?from=search
谁能抵挡咸鱼煎肉饼的美味 下饭神器#家常菜 #粤菜 #下饭菜,6793,,2023/2/12,Lookocherry大徐,www.bilibili.com/video/BV1kx4y1L7hQ?from=search
【品城记】“我们想做自己独有味道的粤菜！” 升级后的小查楼，凭什么这么说？,13.6万,,2022/9/29,品城记本地版,www.bilibili.com/video/BV1ig411e7tj?from=search
中国哪个菜系最受欢迎？川菜/粤菜/湘菜/苏菜/鲁菜/浙菜【数据可视化】,24.9万,,2020/5/13,_江之岛盾子_,www.bilibili.com/video/BV1op4y1Q7zv?from=search
顶级名厨演绎极品食材，难得一见的古法粤菜！,43.8万,,2022/12/10,渣叔爱酒,www.bilibili.com/video/BV1bK41167nj?from=search
成都不多见的高品质粤菜自助，99元一位随便吃，原材料好，出品超预期，强烈推荐！!,26.8万,,2022/8/18,馒头叔叔就是大馒头,www.bilibili.com/video/BV1jg411r7C7?from=search
教你横行大排档的经典粤菜。很简单，但真的很好吃。啤酒小烧烤 再来一锅粉丝煲，绝了！,6.2万,,2021/6/17,小曲和小五,www.bilibili.com/video/BV1h44y1B7AG?from=search
耗时8小时！做出似薯片皮脆的烤乳猪！所有细节和配方，粤菜泰斗利老师带你一探究竟！,74.6万,,2022/7/23,厨邦大师开饭,www.bilibili.com/video/BV1vF411P7yY?from=search
广州传承40多年的老字号粤菜馆，专注怀旧点心，人气爆满,6.8万,,2023/2/13,广州吃货Video,www.bilibili.com/video/BV1c84y1p7sm?from=search
越秀超实惠的街坊粤菜馆，178居然就可以吃到6个菜难怪街坊都坐满，招牌烧鹅更是靓,16.3万,,2021/11/30,毛毛美食指南,www.bilibili.com/video/BV1UM4y1P7Cn?from=search
怎样才叫顶级私房粤菜？天河这家私房餐厅几乎全是少见的顶级粤菜，老广吃过都难忘,22.5万,,2021/7/3,毛毛美食指南,www.bilibili.com/video/BV1c54y1p7NP?from=search
经典粤菜鲍汁捞饭太鲜美了，其实做法很简单！,3.5万,,2023/6/23,南木Cooking,www.bilibili.com/video/BV1su41187gm?from=search
咸鱼蒸肉饼是一道经典的粤菜，可能都会做，但要做好是要技巧的哦,6.3万,,2023/4/13,主厨农国栋,www.bilibili.com/video/BV1VV4y1Z7cL?from=search
广州65元一位的粤菜自助！免茶位还有生蚝刺身？真的好吃吗？,13.4万,,2023/2/21,一支小皮皮,www.bilibili.com/video/BV1c84y1H75G?from=search
杭州城里高性价比的粤菜馆，我终于找到了一份好吃满意的叉烧肉！,2.7万,,2023/8/3,我爸老郑,www.bilibili.com/video/BV1Jk4y1g7oQ?from=search
老广们的饭堂！藏在广州天桥底下的老字号粤菜馆，人均不到40,17.5万,,2022/3/15,广州吃货Video,www.bilibili.com/video/BV1Nu411z7RL?from=search
换种方法做#鸡煲 鲜香味甜！#一只鸡的百种做法 #粤菜,3089,,2023/9/20,Lookocherry大徐,www.bilibili.com/video/BV16P411b7ry?from=search
又吃到好吃的脆皮炸大肠！荔湾龙津老牌街坊粤菜，整体出品不错价格实在,5.5万,,2023/6/24,毛毛美食指南,www.bilibili.com/video/BV1Qg4y1P7Dh?from=search
茄子不用油炸一样好味？咸鱼茄子煲，还得看粤菜师傅怎么做！,29.8万,,2022/10/6,厨师徐嘉乐,www.bilibili.com/video/BV1Be411j7Ur?from=search
能把干炒牛河做到色香味俱全的厨师，才是一个好的粤菜厨师,35.6万,,2020/12/30,主厨农国栋,www.bilibili.com/video/BV1tv411t7hi?from=search
广州这家酒楼，竟能吃到80年代的粤菜味道！,2541,,2023/9/19,Jira蚂蚁觅食,www.bilibili.com/video/BV1394y1p7XA?from=search
发现一家全都是老广在吃的老牌粤菜馆，十分低调但出品却不赖。少有饭店还在做的深井烧鹅，值得一试！真的好香，就是吃多腻！早茶出品也很不错！,3140,,2023/9/11,NeiNei_旅行日记,www.bilibili.com/video/BV18z4y1j7gX?from=search
广州｜员村饭堂3.0～ 37年粤菜老字号 吉利食店｜自费干饭,7135,,2023/9/2,喂食猫大土豆,www.bilibili.com/video/BV1Fu411P7ja?from=search
【中華料理】脆皮烧肉 皮脆肉嫩粤菜好风味,22.9万,,2017/11/22,梧桐的美麗世界,www.bilibili.com/video/BV1kx411V7Hy?from=search
长见识了，绝大部分人都没吃过的，近乎失传的传统粤菜,7.4万,,2023/6/12,大兵探店,www.bilibili.com/video/BV1mu411Y7ff?from=search
在上海造价148亿的大厦吃“最贵粤菜 ”经费在燃烧！1388/位,74.7万,,2020/9/28,张喜喜-,www.bilibili.com/video/BV1TA411J7eG?from=search
八大菜系之--粤菜,785,,2023/2/25,嘚叭美食,www.bilibili.com/video/BV1Es4y187YR?from=search
长见识了，绝大部分人都没吃过的，近乎失传的传统粤菜,7.4万,,2023/6/12,大兵探店,www.bilibili.com/video/BV1mu411Y7ff?from=search
海珠四十年街坊粤菜，为了这道经典炸大肠愿意专门来吃，肥肠爱好者尤其推荐试试,10.8万,,2022/5/1,毛毛美食指南,www.bilibili.com/video/BV1hu411C7HZ?from=search
【梅菜扣肉】粤菜经典，肥而不腻 入口即化,5.8万,,2023/8/21,厨房仔小李,www.bilibili.com/video/BV1pp4y1K71N?from=search
大厨分享一道经典粤菜-“桂花炒翅”，色泽金黄干香扑鼻，收藏了,10.3万,,2019/5/18,主厨农国栋,www.bilibili.com/video/BV1B441177ou?from=search
万万没想到！广东十大名菜竟是这些！堪称人间美味！粤菜经典！来广东必吃美食！吃货们千万不要错过！快来看看有你吃过的几种粤菜？另附广东十大经典名菜排行榜完整榜单！,2550,,2023/6/26,子弹头计划,www.bilibili.com/video/BV1uu411h7rp?from=search
【品城记】过桥石斑鱼、干逼小青龙、“糖心”乳鸽……能把粤菜做到既有创意又味道超群，就问你服不服？,18.8万,,2021/5/25,品城记本地版,www.bilibili.com/video/BV1cA41137wY?from=search
高质量的地道传统粤菜是怎么样的？花都这家老牌粤菜酒楼吃到了原汁原味的正统粤菜,18.4万,,2021/8/7,毛毛美食指南,www.bilibili.com/video/BV1Bf4y1V7jJ?from=search
这该死的老牌街坊粤菜，真的令我欲罢不能，太好吃啦,3.9万,,2023/7/4,大兵探店,www.bilibili.com/video/BV1kP411e79U?from=search
非常美味一道粤菜豆腐火腩，外焦里嫩，再来点汤汁捞饭，正啊！,29.2万,,2021/9/29,主厨农国栋,www.bilibili.com/video/BV1KP4y187cD?from=search
这个酸甜开胃的经典粤菜有人吃过吗？乐哥担保不翻车！夏天快到了，在家学起来！,19.2万,,2022/4/8,厨师徐嘉乐,www.bilibili.com/video/BV1X44y1V7Bw?from=search
【品城记】让大秋吃平靓正的街坊饭堂，合适吗？不过这家传闻白云区很火的粤菜馆确实抵食！,18.7万,,2022/8/27,品城记本地版,www.bilibili.com/video/BV1RV4y1W7mf?from=search
